{
  "$schema": "https://json-schema.org/draft/2020-12/schema",
  "title": "Shop-only bank and round capabilities",
  "type": "object",
  "properties": {
    "version": {
      "const": 1
    },
    "resource_model": {
      "const": "shop_only_bank_round_capabilities"
    },
    "starting_credits": {
      "type": "integer",
      "minimum": 0,
      "maximum": 2147483647
    },
    "wallet_cap": {
      "const": 3600
    },
    "win_payout": {
      "type": "integer",
      "minimum": 0,
      "maximum": 2147483647
    },
    "draw_payout": {
      "type": "integer",
      "minimum": 0,
      "maximum": 2147483647
    },
    "loss_payouts": {
      "type": "array",
      "minItems": 3,
      "maxItems": 3,
      "items": {
        "type": "integer",
        "minimum": 0,
        "maximum": 2147483647
      }
    },
    "max_recovery_tier": {
      "const": 2
    },
    "slot_prices": {
      "type": "object",
      "properties": {
        "signature": {
          "type": "integer",
          "minimum": 1,
          "maximum": 2147483647
        },
        "technique": {
          "type": "integer",
          "minimum": 1,
          "maximum": 2147483647
        },
        "gambit": {
          "type": "integer",
          "minimum": 1,
          "maximum": 2147483647
        },
        "ex": {
          "type": "integer",
          "minimum": 1,
          "maximum": 2400
        },
        "super": {
          "type": "integer",
          "minimum": 1,
          "maximum": 2400
        }
      },
      "required": [
        "signature",
        "technique",
        "gambit",
        "ex",
        "super"
      ],
      "additionalProperties": false
    },
    "loadout_cap": {
      "const": 2400
    },
    "preparation_seconds": {
      "type": "integer",
      "minimum": 0,
      "maximum": 2147483647
    },
    "reveal_seconds": {
      "type": "integer",
      "minimum": 0,
      "maximum": 2147483647
    },
    "lease_duration": {
      "const": "one_round"
    },
    "ex_activation_cost": {
      "const": 0
    },
    "super_activation_costs": {
      "const": [
        0
      ]
    },
    "passive_income": {
      "type": "integer",
      "minimum": 0,
      "maximum": 2147483647
    },
    "combat_income": {
      "type": "integer",
      "minimum": 0,
      "maximum": 2147483647
    },
    "activation_debit": {
      "const": "none"
    },
    "refund_on_whiff_block_parry_interrupt": {
      "const": false
    },
    "default_reserve_floor": {
      "const": 0
    },
    "reserve_policy": {
      "const": "disabled_nonzero_rejected"
    },
    "purchases_debit": {
      "const": "atomic_preparation_commit"
    },
    "win_tier_change": {
      "const": -1
    },
    "loss_tier_change": {
      "const": 1
    },
    "draw_tier_change": {
      "const": 0
    },
    "combat_bank_writes": {
      "const": false
    },
    "slot_limits": {
      "type": "object",
      "properties": {
        "signature": {
          "const": 1
        },
        "technique": {
          "const": 1
        },
        "gambit": {
          "const": 1
        },
        "ex": {
          "const": 2
        },
        "super": {
          "const": 1
        }
      },
      "required": [
        "signature",
        "technique",
        "gambit",
        "ex",
        "super"
      ],
      "additionalProperties": false
    },
    "reward_policy": {
      "type": "object",
      "properties": {
        "counter_hit": {
          "type": "integer",
          "minimum": 0,
          "maximum": 1000
        },
        "anti_air": {
          "type": "integer",
          "minimum": 0,
          "maximum": 1000
        },
        "perfect_parry": {
          "type": "integer",
          "minimum": 0,
          "maximum": 1000
        },
        "category_limit": {
          "type": "integer",
          "minimum": 0,
          "maximum": 10
        },
        "total_limit": {
          "type": "integer",
          "minimum": 0,
          "maximum": 3000
        },
        "perfect_window_eligible_ticks": {
          "type": "integer",
          "minimum": 1,
          "maximum": 10
        }
      },
      "required": [
        "counter_hit",
        "anti_air",
        "perfect_parry",
        "category_limit",
        "total_limit",
        "perfect_window_eligible_ticks"
      ],
      "additionalProperties": false
    }
  },
  "required": [
    "version",
    "resource_model",
    "starting_credits",
    "wallet_cap",
    "win_payout",
    "draw_payout",
    "loss_payouts",
    "max_recovery_tier",
    "slot_prices",
    "loadout_cap",
    "preparation_seconds",
    "reveal_seconds",
    "lease_duration",
    "ex_activation_cost",
    "super_activation_costs",
    "passive_income",
    "combat_income",
    "activation_debit",
    "refund_on_whiff_block_parry_interrupt",
    "default_reserve_floor",
    "reserve_policy",
    "purchases_debit",
    "win_tier_change",
    "loss_tier_change",
    "draw_tier_change",
    "slot_limits",
    "combat_bank_writes",
    "reward_policy"
  ],
  "additionalProperties": false
}
