{
  "version": 1,
  "resource_model": "shop_only_bank_round_capabilities",
  "starting_credits": 600,
  "wallet_cap": 3600,
  "win_payout": 1200,
  "draw_payout": 900,
  "loss_payouts": [
    1200,
    1200,
    1500
  ],
  "max_recovery_tier": 2,
  "slot_prices": {
    "signature": 900,
    "technique": 600,
    "gambit": 300,
    "ex": 600,
    "super": 900
  },
  "loadout_cap": 2400,
  "preparation_seconds": 15,
  "reveal_seconds": 3,
  "lease_duration": "one_round",
  "ex_activation_cost": 0,
  "super_activation_costs": [
    0
  ],
  "passive_income": 0,
  "combat_income": 0,
  "activation_debit": "none",
  "refund_on_whiff_block_parry_interrupt": false,
  "default_reserve_floor": 0,
  "reserve_policy": "disabled_nonzero_rejected",
  "purchases_debit": "atomic_preparation_commit",
  "win_tier_change": -1,
  "loss_tier_change": 1,
  "draw_tier_change": 0,
  "slot_limits": {
    "signature": 1,
    "technique": 1,
    "gambit": 1,
    "ex": 2,
    "super": 1
  },
  "combat_bank_writes": false,
  "reward_policy": {
    "counter_hit": 50,
    "anti_air": 75,
    "perfect_parry": 100,
    "category_limit": 2,
    "total_limit": 300,
    "perfect_window_eligible_ticks": 2
  }
}
